Date,Review
09/12/2025,Nipped in before my train. Chargrilled chicken was juicy and well seasoned. Even though it was busy they were quick. Will be back for sure
10/12/2025,"10/10 would recommend. The food is fresh, the portions are fair, and the staff are always helpful"
10/12/2025,First time trying this branch! portion was smaller than expected! Bit disappointed overall
10/12/2025,Came with a colleague. Chicken nuggets were a hit. Staff were lovely. Deffo coming again
10/12/2025,Brought a friend here who'd never been. She thought it was fine but nothing special. I usually rate it higher so maybe we just caught them on an off day
10/12/2025,Grabbed food on my break. salad looked a bit sad. Not worth the price...
11/12/2025,"Grabbed food on my break, Meatball box was full of flavour, Will be back for sure"
11/12/2025,"nah not for me. paid way too much for what I got. tiny portion, no flavour, slow service"
11/12/2025,"Fair play Leon, the new menu items are banging. Had the spiced cauliflower thing and it was well tasty"
11/12/2025,Not great. Found a hair in my food which obviously put me right off. Staff offered a replacement but I'd lost my appetite
11/12/2025,Honestly a 3.5 out of 5 from me. Food is tasty but the value for money just isnt quite there
12/12/2025,Second visit this week lol - The wrap was packed and really satisfying - Will be back for sure
12/12/2025,So glad there's a Leon near my office now. Makes lunch decisions so much easier
12/12/2025,Quick lunch stop! The vegan box surprised me - rlly good! Even though it was busy they were quick! Can't fault it really. warming food on a bitter cold day
12/12/2025,me and the girls came here after shopping and it was just what we needed. sharing plates and wraps all round
12/12/2025,First time at Leon and wow. Had the chicken wrap with the aioli and it was unreal. Nice to have a fast food option that doesnt make you feel like rubbish after
13/12/2025,"Fair play Leon, the new menu items are banging. Had the spiced cauliflower thing and it was well tasty"
13/12/2025,half the menu seemed unavailable today which was annoying. ended up with the chicken box which was nice enough
13/12/2025,"stopped by on my way to the station and grabbed a chicken wrap. quick service, tasty food, what more do you want really"
13/12/2025,Grabbed food on my break. The chicken wrap was really tasty. One of the better chains out there. perfect for this miserable january weather
14/12/2025,3 stars. It's fine. Not life changing but not bad either. I go when I want something quick and vaguely healthy x
14/12/2025,This is my comfort place honestly. Whenever I don't know what to have for lunch I just come here and get the chicken box. Never once been let down
14/12/2025,Finally gave Leon a try. Baked fries were properly crispy. Can't fault it really. ideal comfort food for winter honestly
14/12/2025,Swung by after the gym and the chicken box hit different when you're properly hungry. Portions are legit here
15/12/2025,Nipped in on my lunch break for the first time. Had the baked fries and a chicken wrap. Really enjoyed it - much better than I expected 👍
15/12/2025,I always recommend Leon to people who say healthy food is boring. One bite of the LOVe burger and they change their minds every time haha
15/12/2025,I don't get the hype around this place. It's just expensive fast food with a health label slapped on it
15/12/2025,Food was solid but the seating area was cramped. Ended up eating on top of the person next to me
16/12/2025,good food. had the chicken box. would come again.
16/12/2025,Second visit this week lol! Seasonal soup was lovely and warming! Proper pleased with that
16/12/2025,office ordered from here. chicken was a bit dry. service was painfully slow. expected better tbh
16/12/2025,Got the kids meal for my daughter and she absolutely loved it. Nice to have a fast food option I don't feel guilty about giving her
16/12/2025,had a craving for something wholesome and leon delivered. the roasted veg box with halloumi was beautiful
17/12/2025,The food was nice but the portion was a bit small for what you pay. I had the supergreen salad and was still hungry after
17/12/2025,"Really nice atmosphere, food came out fast and tasted great. Had the moroccan meatballs which were 10/10. Would happily eat here every day if my wallet allowed it!"
17/12/2025,Atmosphere was a bit hectic and noisy today. Made it hard to enjoy the meal. Food itself was good - chicken wrap was tasty
17/12/2025,Horrible experience today. Staff seemed completely disinterested and my order was wrong twice. Food was barely warm
18/12/2025,"Genuinely one of the worst lunches I've had in a while. The meatball box tasted microwaved. Dry, flavourless, disappointing."
18/12/2025,me and the girls came here after shopping and it was just what we needed. sharing plates and wraps all round
18/12/2025,Mate dragged me here. The halloumi wrap was gorgeous. Highly recommend
18/12/2025,Stopped by after work. portion was smaller than expected. Alright I suppose
18/12/2025,Fine for what it is. I go for the convenience more than anything. It's right next to my office and beats a sad desk sandwich
19/12/2025,waited ages for my food only for it to be lukewarm. the wrap was falling apart and the fries were stone cold. not impressed at all
19/12/2025,Came for breakfast actually! salad looked a bit sad! queue was ridiculous! Expected better tbh
19/12/2025,Quick lunch stop - chicken was a bit dry - Not bad
19/12/2025,"love leon!! the sweet potato falafel wrap is my go to. always consistent, always delicious. the staff here are so lovely too x"
20/12/2025,Mate dragged me here! The vegan box surprised me - really good! Does the job
20/12/2025,The breakfast burrito is an absolute weapon. So filling and tasty. Been coming here every Friday morning for the past month
20/12/2025,Office ordered from here! Sweet potato fries were banging! Can't fault it really
20/12/2025,"Staff were rude, food was rubbish, place was dirty. The unholy trinity. Won't be coming back"
20/12/2025,Hmm it was ok? I've had better from Leon. The wrap was a bit dry and could've used more sauce. Fries were good tho
21/12/2025,good food. had the chicken box. would come again.
21/12/2025,The app said 5 min wait. I waited 25. When I finally got my food it was wrong AND cold. Absolute joke
21/12/2025,had a craving for something wholesome and leon delivered. the roasted veg box with halloumi was beautiful
21/12/2025,The wait was too long for what's supposed to be fast food. Nearly 20 minutes. The food was good but by that point I was hangry
22/12/2025,Ordered on the app - Meatball box was full of flavour - Not bad
22/12/2025,"Absolute rip off. Tiny portions, mediocre food, and they have the nerve to charge nearly a tenner. Greggs down the road is better value and tastier"
22/12/2025,Quick lunch stop - Seasonal soup was lovely and warming - Keep it up
22/12/2025,The breakfast burrito is an absolute weapon. So filling and tasty. Been coming here every Friday morning for the past month
23/12/2025,Actually managed to find a seat at lunchtime for once. Sat in and had the meatball box. So so good. Need to come at quieter times more often
23/12/2025,The food is good but the queue at lunchtime is insane. Waited 15 minutes to order and then another 10 for food
23/12/2025,"Top notch. Came in for a quick bite before my train and had the falafel box. Fresh, tasty and filling. Can't ask for much more than that"
23/12/2025,Came for breakfast actually - Sweet potato fries were banging - Got my food in no time - Might come back...
24/12/2025,"came here with my mate after work, we both had the LOVe burger and shared some fries. proper good. portions are generous too which is always a plus"
24/12/2025,Grabbed food on my break. LOVe burger was spot on. One of the better chains out there
24/12/2025,The brownies here are absolutely lethal. I came in for a healthy lunch and left with a brownie and zero regrets
24/12/2025,the food was cold when it arrived. like properly cold not just 'not hot'. really frustrating!!
25/12/2025,Had the vegan royale today and I'm not even vegan but honestly? incredible. The sauce is something else. Bit of a queue at lunch but worth the wait
25/12/2025,"came for breakfast at 8am. place was quiet, coffee was strong, bacon roll was exactly what i needed. sometimes simplicity is key"
25/12/2025,Decent food let down by the price. I know its 'healthy' fast food but paying nearly a tenner for lunch every day adds up
25/12/2025,Office ordered from here! portion was smaller than expected! service was painfully slow! Probably won't come again
25/12/2025,Ordered on the app. The chicken wrap was really tasty. 5 stars from me
26/12/2025,"Nipped in before my train, Brazilian chicken was incredible, Could be better could be worse"
26/12/2025,Ordered on the app! The vegan box surprised me - really good! Could be better could be worse
26/12/2025,Popped in today. LOVe burger was spot on. Proper pleased with that!!
26/12/2025,Grabbed food on my break - Chargrilled chicken was juicy and well seasoned - 5 stars from me
26/12/2025,Nice enough place but a bit overpriced imo. 9 quid for a wrap and a drink is steep when you can get a meal deal for 3.50 round the corner
27/12/2025,Half the menu seemed unavailable today which was annoying. Ended up with the chicken box which was nice enough
27/12/2025,Alright I guess. The falafel was a bit dry compared to last time. Sweet potato fries saved it. Won't put me off coming back though
27/12/2025,Its ok. Nothing wrong with it but I wouldnt go out of my way to come here. If im passing and hungry then yeah sure
27/12/2025,Grabbed food on my break - Chicken nuggets were a hit - Staff were lovely - Keep it up
28/12/2025,"genuinely one of the worst lunches i've had in a while. the meatball box tasted microwaved. dry, flavourless, disappointing."
28/12/2025,Mate dragged me here! The vegan box surprised me - really good! Deffo coming again
28/12/2025,Second visit this week lol! meatballs were overdone! Not bad
28/12/2025,Dropped in on the way home! The wrap was packed and really satisfying! Alright I suppose
28/12/2025,Fine for what it is. I go for the convenience more than anything. It's right next to my office and beats a sad desk sandwich
29/12/2025,Bit disappointed with the portion sizes lately. The box used to be more generous. Food quality is still there though so thats something
29/12/2025,"Solid 8/10. Food is good, service is quick, atmosphere is pleasant. Only loses marks because it is a bit on the expensive side"
29/12/2025,Swung by for a quick bite! The halloumi wrap was gorgeous! Top stuff
29/12/2025,Hmm it was ok? I've had better from Leon. The wrap was a bit dry and could've used more sauce. Fries were good tho
30/12/2025,Needed something quick - The halloumi wrap was gorgeous - Does the job
30/12/2025,Had a craving for something wholesome and Leon delivered. The roasted veg box with halloumi was beautiful
30/12/2025,Popped in today. Seasonal soup was lovely and warming. queue was ridiculous. Not bad
30/12/2025,"had the brazilian chicken bowl and it was heavenly. the rice was fluffy, chicken was perfectly seasoned. chef's kiss"
31/12/2025,Nipped in on my lunch break for the first time. Had the baked fries and a chicken wrap. Really enjoyed it - much better than I expected!
31/12/2025,The fact that Leon exists makes my work week bearable. That's my review. 5 stars
31/12/2025,Really pleased with my lunch today. Had the grilled chicken salad and it was packed with good stuff
31/12/2025,Its ok. Nothing wrong with it but I wouldnt go out of my way to come here. If im passing and hungry then yeah sure
01/01/2026,Came with a colleague - food was lukewarm at best - they got my order wrong - Hopefully just an off day
01/01/2026,Took my kids here and they actually ate everything without complaining which is basically a miracle. The chicken nuggets went down a treat and the staff were patient with us
01/01/2026,Bit disappointed with the portion sizes lately. The box used to be more generous. Food quality is still there though so thats something
01/01/2026,"Clean restaurant, friendly staff, great food. The holy trinity"
02/01/2026,Honestly Leon is the only chain restaurant that consistently delivers. Had the chicken wrap again (shocking I know) and it was perfect
02/01/2026,Ordered on the app - Baked fries were properly crispy - Top stuff
02/01/2026,"Came here for lunch, Chicken nuggets were a hit, 3/5. ideal comfort food for winter honestly"
02/01/2026,"came at lunch and the place was filthy. tables hadnt been wiped down, floor was sticky and the bins were overflowing"
03/01/2026,Had a work lunch meeting here and everyone was impressed. Good range of options for different dietary requirements
03/01/2026,Ordered on the app. Baked fries were properly crispy. Does the job
03/01/2026,"came at lunch and the place was filthy. tables hadnt been wiped down, floor was sticky and the bins were overflowing"
03/01/2026,third time this month i think! sweet potato fries were banging! the team here are always friendly! can't fault it really
04/01/2026,i eat here probably 3 times a week and i regret nothing. the quality is always there
04/01/2026,Took my mum here and she was really impressed. She doesn't usually do fast food but she loved the halloumi box. Big win
04/01/2026,The hot sauce they do goes with absolutely everything. I put it on my chicken box and it elevated it to another level. Highly recommend
04/01/2026,Just had the best lunch I've had in ages. Chicken and chorizo box with the chargrilled veg. Everything was perfect
05/01/2026,Had a work lunch meeting here and everyone was impressed. Good range of options for different dietary requirements
05/01/2026,Nipped in before my train! wrap was falling apart! service was painfully slow! 3/5
05/01/2026,"Really let down by this branch. I love Leon normally but this was a shambles. Wrong order, cold food, staff didn't seem to care"
05/01/2026,"Second visit this week lol, The chicken wrap was really tasty, Highly recommend"
06/01/2026,Came for breakfast actually! The wrap was packed and really satisfying! Does the job
06/01/2026,"Stopped by after work, The chicken wrap was rlly tasty, Top stuff"
06/01/2026,Just had the best lunch I've had in ages. Chicken and chorizo box with the chargrilled veg. Everything was perfect
06/01/2026,First time at Leon and wow. Had the chicken wrap with the aioli and it was unreal. Nice to have a fast food option that doesnt make you feel like rubbish after
06/01/2026,Ordered through the app and it wasnt ready when I arrived even though it said it would be. Waited another 5 mins. Food was fine
07/01/2026,Came here for lunch - The halloumi wrap was gorgeous - Love this place
07/01/2026,Grabbed food on my break - LOVe burger was spot on - Might come back
07/01/2026,Came for breakfast actually! Seasonal soup was lovely and warming! Highly recommend
07/01/2026,Never again. Ordered the chicken box and it was so dry I nearly choked. Zero seasoning. Fries were bendy and sad. Waste of money
07/01/2026,"Solid 8/10. Food is good, service is quick, atmosphere is pleasant. Only loses marks because it is a bit on the expensive side"
08/01/2026,swung by after the gym and the chicken box hit different when you're properly hungry. portions are legit here
08/01/2026,"Gotta give credit where it's due - Leon on the app is seamless. Order ahead, walk in, grab and go. Food quality stays consistent too which is the main thing"
08/01/2026,This Leon does cracking breakfast. Scrambled eggs on sourdough with a flat white. Proper start to the day
08/01/2026,Quick lunch stop - LOVe burger was spot on - Proper pleased with that
09/01/2026,"Massive fan of this place. The sweet potato falafel wrap is unreal - crispy, flavourful, filling lol"
09/01/2026,Its ok. Nothing wrong with it but I wouldnt go out of my way to come here. If im passing and hungry then yeah sure!!
09/01/2026,Needed something quick. Brazilian chicken was incredible. Love this place
09/01/2026,Been coming here for a while now. wrap was falling apart. queue was ridiculous. Shame really
10/01/2026,"I like Leon conceptually but this branch can be a bit inconsistent. Sometimes amazing, sometimes rushed"
10/01/2026,half the menu seemed unavailable today which was annoying. ended up with the chicken box which was nice enough
10/01/2026,Would give zero stars if I could. Chicken was raw in the middle. ACTUALLY RAW. Had to send it back. How does that even happen
10/01/2026,"came for breakfast at 8am. place was quiet, coffee was strong, bacon roll was exactly what I needed. sometimes simplicity is key"
10/01/2026,Overpriced and underwhelming. The 'superfood salad' was just some leaves and a few bits of chicken
11/01/2026,Half the menu seemed unavailable today which was annoying. Ended up with the chicken box which was nice enough
11/01/2026,Massively disappointing. Had the LOVe burger and it was cold and dry. For the price they charge you'd expect better. Won't be rushing back
11/01/2026,Stopped by after work - food was lukewarm at best - Probably won't come again
11/01/2026,Horrible experience today. Staff seemed completely disinterested and my order was wrong twice. Food was barely warm
12/01/2026,Best fast food chain in the UK and I will die on this hill. The quality is leagues above everything else
12/01/2026,Had the seasonal salad and it was ok. A bit overdressed for my taste. The chicken was good but the leaves were sad looking
12/01/2026,Dropped in on the way home - Chargrilled chicken was juicy and well seasoned - Might come back
12/01/2026,"Popped in for a quick lunch and honestly couldn't fault it. The LOVe burger was banging, chips were crispy and the staff were dead friendly. Will deffo be back!!"
13/01/2026,Finally gave Leon a try - Sweet potato fries were banging - Proper pleased with that
13/01/2026,Alright I guess. The falafel was a bit dry compared to last time. Sweet potato fries saved it. Won't put me off coming back though
13/01/2026,had better days here. the salad was a bit limp and the dressing was minimal. chicken was nice at least. 3/5
13/01/2026,The food was nice but the portion was a bit small for what you pay. I had the supergreen salad and was still hungry after
13/01/2026,Came with a colleague! everything tasted a bit bland! Won't be rushing back
14/01/2026,The food is good but the queue at lunchtime is insane. Waited 15 minutes to order and then another 10 for food
14/01/2026,Popped in today. LOVe burger was spot on. Staff were lovely. Deffo coming again
14/01/2026,tried the new seasonal menu item today and it was really good! nice to see they keep things fresh
14/01/2026,always pop in here when i'm in town shopping. the grilled chicken salad box never disappoints and the staff are always so cheerful
15/01/2026,"absolute rip off. tiny portions, mediocre food, and they have the nerve to charge nearly a tenner. greggs down the road is better value and tastier"
15/01/2026,The app said 5 min wait. I waited 25. When I finally got my food it was wrong AND cold. Absolute joke
15/01/2026,Discovered this place last week and already been back 3 times. The chargrilled chicken is addictive I swear
15/01/2026,Literally the only fast food chain I actually feel good about eating at. Had the raw slaw with the chargrilled chicken
16/01/2026,Office ordered from here. Supergreen salad was fresh and filling. Does the job
16/01/2026,Swung by for a quick bite - Falafel box was excellent - Staff were really helpful with allergens - It's fine 👍
16/01/2026,"came for breakfast at 8am. place was quiet, coffee was strong, bacon roll was exactly what I needed. sometimes simplicity is key"
16/01/2026,Lunch sorted in under 10 minutes and it actually tasted amazing. The falafel wrap with extra chilli sauce is a vibe :)
16/01/2026,Atmosphere was a bit hectic and noisy today. Made it hard to enjoy the meal. Food itself was good - chicken wrap was tasty
17/01/2026,"What happened to this place? Portions smaller, prices higher, food not as good. Proper gutted"
17/01/2026,Would give zero stars if I could. Chicken was raw in the middle. ACTUALLY RAW. Had to send it back. How does that even happen
17/01/2026,My favourite lunch spot in the area hands down. The menu has enough variety that I never get bored and everything I've tried has been quality
17/01/2026,Not great. Found a hair in my food which obviously put me right off. Staff offered a replacement but I'd lost my appetite
17/01/2026,Fine for what it is. I go for the convenience more than anything. It's right next to my office and beats a sad desk sandwich
18/01/2026,Had the vegan royale today and I'm not even vegan but honestly? incredible. The sauce is something else. Bit of a queue at lunch but worth the wait
18/01/2026,Nipped in before my train - The halloumi wrap was gorgeous - Keep it up
18/01/2026,Swung by for a quick bite - The wrap was packed and really satisfying - It's fine
18/01/2026,Really good. I always get the supergreen salad with added chicken and it never disappoints
18/01/2026,obsessed with the aioli sauce. I literally put it on everything. Had the grilled chicken today - absolutely beautiful. 5 stars from me
19/01/2026,Had the seasonal soup and a bread roll. Soup was piping hot and really flavourful. Perfect for this weather
19/01/2026,Honestly shocked at how bad this was. I love the Leon near my house but this branch is clearly not bothered. Food was grim
19/01/2026,"Great coffee and the banana bread is SO good. Sat in and did some work for an hour - really nice vibe, not too loud, good wifi"
19/01/2026,"Nipped in before my train, The chicken wrap was really tasty, Keep it up"
19/01/2026,I always recommend Leon to people who say healthy food is boring. One bite of the LOVe burger and they change their minds every time haha
20/01/2026,"chicken tasted reheated, salad was wilted, and they charged me extra for a sauce that never arrived. not happy"
20/01/2026,Walked past and thought why not! The chicken wrap was rlly tasty! queue was ridiculous! Not bad
20/01/2026,came here for lunch! baked fries were properly crispy! quick and efficient as always! 3/5
20/01/2026,Came here for lunch. portion was smaller than expected. Might come back
21/01/2026,took my kids here and they actually ate everything without complaining which is basically a miracle. the chicken nuggets went down a treat and the staff were patient with us
21/01/2026,Brought a friend here who'd never been. She thought it was fine but nothing special. I usually rate it higher so maybe we just caught them on an off day
21/01/2026,Nipped in before my train! salad looked a bit sad! 3/5
21/01/2026,Horrible experience today. Staff seemed completely disinterested and my order was wrong twice. Food was barely warm
22/01/2026,Been coming here for months but today was the final straw. Quality has nosedived. The halloumi was rubbery and everything was lukewarm. Done.
22/01/2026,came for breakfast actually. seasonal soup was lovely and warming. quick and efficient as always. proper pleased with that
22/01/2026,"Office ordered from here, The halloumi wrap was gorgeous, Top stuff"
22/01/2026,Popped in today! The chicken wrap was really tasty! Service was spot on! Deffo coming again
23/01/2026,food was great as always. love the chicken wrap. only thing is they were out of baked fries today which was annoying but these things happen I suppose
23/01/2026,"The app ordering is dead handy. Placed my order on the bus, walked in and it was ready. Love it when places actually have their tech sorted"
23/01/2026,Been coming here for a while now. fries were soggy unfortunately. Alright I suppose
23/01/2026,stopped by after work - brazilian chicken was incredible - not bad
24/01/2026,The food was nice but the portion was a bit small for what you pay. I had the supergreen salad and was still hungry after
24/01/2026,Second visit this week lol. Sweet potato fries were banging. Quick and efficient as always. Top stuff
24/01/2026,Waited ages for my food only for it to be lukewarm. The wrap was falling apart and the fries were stone cold. Not impressed at all
24/01/2026,"Lunch meeting here, Falafel box was excellent, App ordering was seamless, Keep it up"
25/01/2026,Had a lovely breakfast here this morning. The eggs and bacon were cooked perfectly and the coffee was actually good - not always a given at these kinds of places
25/01/2026,Got the kids meal for my daughter and she absolutely loved it. Nice to have a fast food option I don't feel guilty about giving her
25/01/2026,came for breakfast actually - love burger was spot on - staff were lovely - can't fault it really x
25/01/2026,Came with a colleague - The halloumi wrap was gorgeous - 5 stars from me!!
26/01/2026,Honestly Leon is the only chain restaurant that consistently delivers. Had the chicken wrap again (shocking I know) and it was perfect
26/01/2026,food was great as always. love the chicken wrap. only thing is they were out of baked fries today which was annoying but these things happen I suppose
26/01/2026,Wish the portions were a bit bigger for the price. I always leave thinking I could've eaten more. Quality is there though
26/01/2026,good food. had the chicken box. would come again.
26/01/2026,"Good food, rubbish seating. Why are the tables always so sticky? Give them a wipe please. Chicken box was lovely though"
27/01/2026,"Coffee was average, food was better. The halloumi box was nice but could've done with more halloumi tbh"
27/01/2026,"came for breakfast at 8am. place was quiet, coffee was strong, bacon roll was exactly what I needed. sometimes simplicity is key"
27/01/2026,"everything was spot on today. quick service, food was hot and fresh, and the portions were decent. had the moroccan meatball box. really satisfying lunch"
27/01/2026,Ordered on the app! The wrap was packed and really satisfying! Keep it up. just what you need in this freezing weather
