Date,Review
20/10/2025,The fact that Leon exists makes my work week bearable. That's my review. 5 stars.
21/10/2025,"The app ordering is dead handy. Placed my order on the bus, walked in and it was ready. Love it when places actually have their tech sorted"
21/10/2025,"Really nice atmosphere, food came out fast and tasted great. Had the moroccan meatballs which were 10/10. Would happily eat here every day if my wallet allowed it!"
21/10/2025,Walked past and thought why not - Meatball box was full of flavour - Keep it up
21/10/2025,Needed something quick. everything tasted a bit bland. Hopefully just an off day
22/10/2025,First time trying this branch - everything tasted a bit bland - they got my order wrong - Won't be rushing back
22/10/2025,First time trying this branch! the rice was a bit clumpy! Shame really
22/10/2025,mate recommended this place and he was spot on. had the chicken wrap and sweet potato fries. both were class. cheers dave!!
22/10/2025,"Good food, rubbish seating. Why are the tables always so sticky? Give them a wipe please. Chicken box was lovely though"
23/10/2025,Its ok. Nothing wrong with it but I wouldnt go out of my way to come here. If im passing and hungry then yeah sure
23/10/2025,its alright. food is decent but nothing amazing. had the chicken wrap and it was fine - just a bit bland if im honest. fries were good though
23/10/2025,Went for the seasonal salad and it was really fresh and flavourful. Nice change from the usual lunch options round here
23/10/2025,Grabbed food on my break! Brazilian chicken was incredible! Top stuff
24/10/2025,been coming here for a while now! everything tasted a bit bland! queue was ridiculous! probably won't come again
24/10/2025,Walked past and thought why not! meatballs were overdone! they got my order wrong! Won't be rushing back
24/10/2025,Had the vegan royale today and I'm not even vegan but honestly? incredible. The sauce is something else. Bit of a queue at lunch but worth the wait
24/10/2025,Hmm it was ok? I've had better from Leon. The wrap was a bit dry and could've used more sauce. Fries were good tho
25/10/2025,"Ordered on the app, The vegan box surprised me - really good, Love this place"
25/10/2025,Bit busy at lunchtime but that's to be expected innit. Food was worth the short wait. Brazilian chicken box was banging
25/10/2025,"10/10 would recommend. The food is fresh, the portions are fair, and the staff are always helpful"
25/10/2025,me and the girls came here after shopping and it was just what we needed. sharing plates and wraps all round
26/10/2025,Office ordered from here! salad looked a bit sad! service was painfully slow! Bit disappointed overall
26/10/2025,Been coming here for a while now! Meatball box was full of flavour! Quick and efficient as always! 5 stars from me
26/10/2025,"such a reliable option when i cant be bothered to cook. ordered through the app, picked it up in 5 mins flat. chicken wrap was mint as always"
26/10/2025,Needed something quick! The halloumi wrap was gorgeous! Would recommend to anyone
27/10/2025,Walked past and thought why not! Sweet potato fries were banging! Love this place
27/10/2025,the nuggets here are properly good. none of that processed rubbish. my kids go mental for them
27/10/2025,"Dropped in on the way home, portion was smaller than expected, Won't be rushing back"
27/10/2025,"Dropped in on the way home, chicken was a bit dry, Expected better tbh"
28/10/2025,Lunch sorted in under 10 minutes and it actually tasted amazing. The falafel wrap with extra chilli sauce is a vibe
28/10/2025,Never again. Ordered the chicken box and it was so dry I nearly choked. Zero seasoning. Fries were bendy and sad. Waste of money
28/10/2025,Came for breakfast actually! Brazilian chicken was incredible! Deffo coming again
28/10/2025,Had the seasonal soup and a bread roll. Soup was piping hot and really flavourful. Perfect for this weather
28/10/2025,"Genuinely one of the worst lunches I've had in a while. The meatball box tasted microwaved. Dry, flavourless, disappointing"
29/10/2025,Been coming here for a while now! Seasonal soup was lovely and warming! App ordering was seamless! Deffo coming again
29/10/2025,"10/10 would recommend. The food is fresh, the portions are fair, and the staff are always helpful"
29/10/2025,"Quick lunch stop, The halloumi wrap was gorgeous, Service was spot on, Not bad"
29/10/2025,Ordered on the app! Seasonal soup was lovely and warming! App ordering was seamless! 5 stars from me
30/10/2025,"Coffee was average, food was better. The halloumi box was nice but could've done with more halloumi tbh"
30/10/2025,"good food, rubbish seating. why are the tables always so sticky? give them a wipe please. chicken box was lovely though"
30/10/2025,"Massive fan of this place. The sweet potato falafel wrap is unreal - crispy, flavourful, filling"
30/10/2025,"Grabbed food on my break, everything tasted a bit bland, Expected better tbh"
31/10/2025,Look I'm not the type to leave reviews but this place deserves one. Consistently good food every single time I visit
31/10/2025,LOVE the fact they do proper gluten free options. Had the GF chicken wrap and you genuinely couldn't tell the difference
31/10/2025,"Been coming here for a while now, Meatball box was full of flavour, service was painfully slow, 3/5"
31/10/2025,brought my partner here for the first time and she loved it! she had the vegan wrap and said it was the best she'd had from a chain. big praise from her trust me
31/10/2025,Half the menu seemed unavailable today which was annoying. Ended up with the chicken box which was nice enough
01/11/2025,"mate dragged me here, baked fries were properly crispy, love this place"
01/11/2025,"Massive fan of this place. The sweet potato falafel wrap is unreal - crispy, flavourful, filling"
01/11/2025,"popped in today, brazilian chicken was incredible, even though it was busy they were quick, highly recommend :)"
01/11/2025,could do with being a bit warmer inside. food was perfectly fine but eating a salad in a cold restaurant isn't the one
02/11/2025,Best fast food chain in the UK and I will die on this hill. The quality is leagues above everything else
02/11/2025,"Walked past and thought why not, chicken was a bit dry, no one seemed to know what was going on, Expected better tbh"
02/11/2025,Office ordered from here - Seasonal soup was lovely and warming - Staff were really helpful with allergens - Might come back
02/11/2025,tried the new seasonal menu item today and it was really good! nice to see they keep things fresh
03/11/2025,sorry but ten quid for a mediocre wrap and some sad looking fries is a joke. the food was bland and the portion was tiny
03/11/2025,Went for the seasonal salad and it was really fresh and flavourful. Nice change from the usual lunch options round here
03/11/2025,food was good but they got my order wrong. I asked for no onions and there were onions everywhere. Staff apologised though
03/11/2025,Best fast food chain in the UK and I will die on this hill. The quality is leagues above everything else
03/11/2025,"Walked past and thought why not, The vegan box surprised me - really good, Love this place. nice to warm up on a cold day"
04/11/2025,Don't bother. Got the meatball wrap and it was basically empty. Like 3 meatballs in a massive wrap with some sauce. Pathetic
04/11/2025,"came for breakfast at 8am. place was quiet, coffee was strong, bacon roll was exactly what I needed. sometimes simplicity is key"
04/11/2025,"First time trying this branch, Supergreen salad was fresh and filling, 3/5. great autumn lunch option"
04/11/2025,Finally gave Leon a try - LOVe burger was spot on - Could be better could be worse
04/11/2025,Stopped by after work. the rice was a bit clumpy. 3/5
05/11/2025,Finally gave Leon a try. Meatball box was full of flavour. Highly recommend
05/11/2025,Great spot for a healthy-ish lunch when you're sick of Pret. Had the grilled halloumi wrap - really tasty
05/11/2025,"First time trying this branch, The wrap was packed and really satisfying, Got my food in no time, Love this place"
05/11/2025,had the vegan royale today and i'm not even vegan but honestly? incredible. the sauce is something else. bit of a queue at lunch but worth the wait...
06/11/2025,Third time this month I think! Sweet potato fries were banging! Deffo coming again. exactly what you need when its grey outside
06/11/2025,Office ordered from here - The halloumi wrap was gorgeous - Staff were really helpful with allergens - See you next week Leon
06/11/2025,Fine for what it is. I go for the convenience more than anything. It's right next to my office and beats a sad desk sandwich
06/11/2025,I was veggie for years and Leon was always my go to. Now I eat chicken again their menu is even better. The grilled chicken box is elite
07/11/2025,"Office ordered from here, Falafel box was excellent, Would recommend to anyone"
07/11/2025,"came here with my mate after work, we both had the LOVe burger and shared some fries. proper good. portions are generous too which is always a plus"
07/11/2025,Grabbed food on my break! The wrap was packed and really satisfying! Service was spot on! Highly recommend
07/11/2025,Quick lunch stop! portion was smaller than expected! no one seemed to know what was going on! Not worth the price
08/11/2025,Second visit this week lol. Supergreen salad was fresh and filling. Love this place
08/11/2025,Could do with being a bit warmer inside. Food was perfectly fine but eating a salad in a cold restaurant isn't the one
08/11/2025,Popped in today! Supergreen salad was fresh and filling! Can't fault it really
08/11/2025,tried leon for the first time today. the halloumi box was delicious and i loved the vibe of the place. will be back for sure
08/11/2025,"Absolute rip off. Tiny portions, mediocre food, and they have the nerve to charge nearly a tenner. Greggs down the road is better value and tastier"
09/11/2025,The food was nice but the portion was a bit small for what you pay. I had the supergreen salad and was still hungry after :)
09/11/2025,This Leon does cracking breakfast. Scrambled eggs on sourdough with a flat white. Proper start to the day
09/11/2025,Mate dragged me here! Chicken nuggets were a hit! Staff were lovely! Top stuff
09/11/2025,Swung by after the gym and the chicken box hit different when you're properly hungry. Portions are legit here
10/11/2025,Mate dragged me here - Seasonal soup was lovely and warming - One of the better chains out there
10/11/2025,v impressed with the gluten free options here. as a coeliac i normally struggle but they were really helpful and the food was just as good
10/11/2025,mate dragged me here! the chicken wrap was really tasty! the team here are always friendly! proper pleased with that
10/11/2025,lunch meeting here. wrap was falling apart. hopefully just an off day
10/11/2025,"Really nice atmosphere, food came out fast and tasted great. Had the moroccan meatballs which were 10/10. Would happily eat here every day if my wallet allowed it x"
11/11/2025,Been coming here for a while now - Falafel box was excellent - Quick and efficient as always - Top stuff
11/11/2025,Look I'm not the type to leave reviews but this place deserves one. Consistently good food every single time I visit
11/11/2025,Stopped by after work. The wrap was packed and really satisfying. It's fine
11/11/2025,Half the menu seemed unavailable today which was annoying. Ended up with the chicken box which was nice enough
11/11/2025,"Nice food, nice people. Got the LOVe burger combo and it was well good. The drink options are class too - had the ginger kombucha"
12/11/2025,First time trying this branch! The wrap was packed and really satisfying! Could be better could be worse
12/11/2025,Third time this month I think! Falafel box was excellent! The team here are always friendly! Love this place
12/11/2025,Grabbed food on my break - everything tasted a bit bland - Could be better could be worse
12/11/2025,"Nice food, nice people. Got the LOVe burger combo and it was well good. The drink options are class too - had the ginger kombucha"
13/11/2025,Bit busy at lunchtime but that's to be expected innit. Food was worth the short wait. Brazilian chicken box was banging
13/11/2025,Lunch meeting here. Meatball box was full of flavour. The team here are always friendly. Can't fault it really
13/11/2025,"came here with my mate after work, we both had the LOVe burger and shared some fries. proper good. portions are generous too which is always a plus"
13/11/2025,Service was a bit slow today which is unusual. Food was nice when it eventually came though. Had the moroccan meatballs
14/11/2025,swung by after the gym and the chicken box hit different when you're properly hungry. portions are legit here
14/11/2025,"Swung by for a quick bite, Chicken nuggets were a hit, Staff were lovely, Love this place"
14/11/2025,"Chicken tasted reheated, salad was wilted, and they charged me extra for a sauce that never arrived. Not happy"
14/11/2025,Walked past and thought why not! Brazilian chicken was incredible! Can't fault it rlly
14/11/2025,"Dropped in on the way home, Baked fries were properly crispy, Even though it was busy they were quick, Highly recommend"
15/11/2025,"Came for breakfast actually, salad looked a bit sad, Even though it was busy they were quick, Might come back"
15/11/2025,wish the portions were a bit bigger for the price. i always leave thinking i could've eaten more. quality is there though
15/11/2025,Lunch meeting here! food was lukewarm at best! Alright I suppose
15/11/2025,Mate dragged me here. Brazilian chicken was incredible. Staff were lovely. Would recommend to anyone
15/11/2025,The hot sauce they do goes with absolutely everything. I put it on my chicken box and it elevated it to another level. Highly recommend
16/11/2025,Third time this month I think - Baked fries were properly crispy - Can't fault it really
16/11/2025,"Absolute rip off. Tiny portions, mediocre food, and they have the nerve to charge nearly a tenner. Greggs down the road is better value and tastier"
16/11/2025,"Ordered on the app, The vegan box surprised me - really good, Even though it was busy they were quick, 5 stars from me"
16/11/2025,Walked past and thought why not. LOVe burger was spot on. Not bad. perfect for this chilly weather
17/11/2025,"10/10 would recommend. The food is fresh, the portions are fair, and the staff are always helpful"
17/11/2025,Second visit this week lol. Brazilian chicken was incredible. App ordering was seamless. Top stuff
17/11/2025,My go to order is the chicken wrap with extra aioli and baked fries. Never fails. Today was no exception
17/11/2025,"Walked past and thought why not, Baked fries were properly crispy, Proper pleased with that"
18/11/2025,Look the food is genuinely nice but I just cannot justify coming here every day at these prices. Once or twice a week max
18/11/2025,My favourite lunch spot in the area hands down. The menu has enough variety that I never get bored and everything I've tried has been quality
18/11/2025,"grabbed food on my break, brazilian chicken was incredible, love this place"
18/11/2025,Picked up a couple of wraps for me and the missus on the way home. Both really enjoyed them. Easy dinner sorted
18/11/2025,Had the seasonal salad and it was ok. A bit overdressed for my taste. The chicken was good but the leaves were sad looking
19/11/2025,"Mate dragged me here, Sweet potato fries were banging, Can't fault it really"
19/11/2025,"Second visit this week lol, Falafel box was excellent, Might come back"
19/11/2025,Took my kids here and they actually ate everything without complaining which is basically a miracle. The chicken nuggets went down a treat and the staff were patient with us
19/11/2025,Office ordered from here - The halloumi wrap was gorgeous - Quick and efficient as always - Top stuff
20/11/2025,"Came for breakfast actually, food was lukewarm at best, 3/5!!"
20/11/2025,Always pop in here when I'm in town shopping. The grilled chicken salad box never disappoints and the staff are always so cheerful
20/11/2025,"came here with my mate after work, we both had the LOVe burger and shared some fries. proper good. portions are generous too which is always a plus"
20/11/2025,me and the girls came here after shopping and it was just what we needed. sharing plates and wraps all round
21/11/2025,Office ordered from here - The vegan box surprised me - really good - Quick and efficient as always - Highly recommend
21/11/2025,Massively disappointing. Had the LOVe burger and it was cold and dry. For the price they charge you'd expect better. Won't be rushing back
21/11/2025,Just discovered you can customise your box and add extra bits. Game changer
21/11/2025,"Solid 8/10. Food is good, service is quick, atmosphere is pleasant. Only loses marks because it is a bit on the expensive side!!"
21/11/2025,Bit busy at lunchtime but that's to be expected innit. Food was worth the short wait. Brazilian chicken box was banging
22/11/2025,Office ordered from here. everything tasted a bit bland. It's fine!!
22/11/2025,I always recommend Leon to people who say healthy food is boring. One bite of the LOVe burger and they change their minds every time haha
22/11/2025,"Popped in for a quick lunch and honestly couldn't fault it. The LOVe burger was banging, chips were crispy and the staff were dead friendly. Will deffo be back"
22/11/2025,Don't bother. Got the meatball wrap and it was basically empty. Like 3 meatballs in a massive wrap with some sauce. Pathetic lol
23/11/2025,Liked the food but the restaurant was absolutely freezing. Like uncomfortably cold. Had to eat with my coat on
23/11/2025,Decent. Had the chicken box with the baked fries and it hit the spot. Service was quick which is what you want on a lunch break. 4/5
23/11/2025,Lunch meeting here! fries were soggy unfortunately! staff seemed a bit stressed tbh! Expected better tbh
23/11/2025,"Clean restaurant, friendly staff, great food. The holy trinity"
24/11/2025,Finally a fast food place that doesn't leave me feeling like I need a nap after. Had the grilled chicken salad. Energised and full. What a concept
24/11/2025,Had the seasonal salad and it was ok. A bit overdressed for my taste. The chicken was good but the leaves were sad looking
24/11/2025,brought my partner here for the first time and she loved it! she had the vegan wrap and said it was the best she'd had from a chain. big praise from her trust me
24/11/2025,had better days here. the salad was a bit limp and the dressing was minimal. chicken was nice at least. 3/5
25/11/2025,Second visit this week lol - Chargrilled chicken was juicy and well seasoned - Top stuff
25/11/2025,sorry but ten quid for a mediocre wrap and some sad looking fries is a joke. the food was bland and the portion was tiny
25/11/2025,Just had the best lunch I've had in ages. Chicken and chorizo box with the chargrilled veg. Everything was perfect!!
25/11/2025,Finally gave Leon a try - Seasonal soup was lovely and warming - Could be better could be worse. perfect for this chilly weather
26/11/2025,"Quick lunch stop, fries were soggy unfortunately, Probably won't come again"
26/11/2025,"Came with a colleague, Brazilian chicken was incredible, Would recommend to anyone"
26/11/2025,"Stopped by after work, Supergreen salad was fresh and filling, Staff were lovely, Can't fault it really"
26/11/2025,Love the concept hate the prices. It's just too much for fast food. The food IS good though so I keep coming back like a mug
26/11/2025,Ordered through the app and it wasnt ready when I arrived even though it said it would be. Waited another 5 mins. Food was fine
27/11/2025,Came here for lunch - salad looked a bit sad - Not worth the price
27/11/2025,Nice enough place but a bit overpriced imo. 9 quid for a wrap and a drink is steep when you can get a meal deal for 3.50 round the corner
27/11/2025,"such a reliable option when i cant be bothered to cook. ordered through the app, picked it up in 5 mins flat. chicken wrap was mint as always"
27/11/2025,"chicken tasted reheated, salad was wilted, and they charged me extra for a sauce that never arrived. not happy"
28/11/2025,Stopped by after work! The vegan box surprised me - really good! queue was ridiculous! 3/5
28/11/2025,"top notch. came in for a quick bite before my train and had the falafel box. fresh, tasty and filling. can't ask for much more than that"
28/11/2025,Popped in today - Chargrilled chicken was juicy and well seasoned - Quick and efficient as always - Would recommend to anyone :)
28/11/2025,Swung by for a quick bite - Chargrilled chicken was juicy and well seasoned - Even though it was busy they were quick - Love this place
29/11/2025,"Nice food, nice people. Got the LOVe burger combo and it was well good. The drink options are class too - had the ginger kombucha"
29/11/2025,Swung by for a quick bite - Falafel box was excellent - Staff were lovely - Keep it up x
29/11/2025,Finally gave Leon a try - Chicken nuggets were a hit - Staff were lovely - Can't fault it really
29/11/2025,food was good but they got my order wrong. I asked for no onions and there were onions everywhere. Staff apologised though
30/11/2025,"Swung by for a quick bite, Chargrilled chicken was juicy and well seasoned, The team here are always friendly, One of the better chains out there"
30/11/2025,The food is good but the queue at lunchtime is insane. Waited 15 minutes to order and then another 10 for food
30/11/2025,I don't get the hype around this place. It's just expensive fast food with a health label slapped on it
30/11/2025,Second visit this week lol. Brazilian chicken was incredible. Staff were really helpful with allergens. Love this place
01/12/2025,Came with a colleague! LOVe burger was spot on! App ordering was seamless! Highly recommend
01/12/2025,"I like Leon conceptually but this branch can be a bit inconsistent. Sometimes amazing, sometimes rushed"
01/12/2025,Lunch meeting here. Meatball box was full of flavour. Staff were lovely. It's fine
01/12/2025,Had the vegan wrap. Taste was good but it fell apart immediately which was messy and annoying
02/12/2025,Came for breakfast actually! food was lukewarm at best! Not worth the price
02/12/2025,Popped in today - Meatball box was full of flavour - Staff were really helpful with allergens - Love this place
02/12/2025,Stopped by after work - The wrap was packed and really satisfying - Got my food in no time - Highly recommend
02/12/2025,Mate dragged me here - Seasonal soup was lovely and warming - Will be back for sure
03/12/2025,Honestly Leon is the only chain restaurant that consistently delivers. Had the chicken wrap again (shocking I know) and it was perfect
03/12/2025,"Lunch meeting here, Sweet potato fries were banging, Love this place"
03/12/2025,"Came here for lunch, wrap was falling apart, Bit disappointed overall"
03/12/2025,Just had the best lunch I've had in ages. Chicken and chorizo box with the chargrilled veg. Everything was perfect
04/12/2025,"Really nice atmosphere, food came out fast and tasted great. Had the moroccan meatballs which were 10/10. Would happily eat here every day if my wallet allowed it!"
04/12/2025,Just discovered you can customise your box and add extra bits. Game changer
04/12/2025,Lunch meeting here - Supergreen salad was fresh and filling - Proper pleased with that!!
04/12/2025,"Second visit this week lol, Meatball box was full of flavour, 5 stars from me"
05/12/2025,Liked the food but the restaurant was absolutely freezing. Like uncomfortably cold. Had to eat with my coat on
05/12/2025,Its ok. Nothing wrong with it but I wouldnt go out of my way to come here. If im passing and hungry then yeah sure
05/12/2025,The brownies here are absolutely lethal. I came in for a healthy lunch and left with a brownie and zero regrets
05/12/2025,"Dropped in on the way home, food was lukewarm at best, Does the job"
06/12/2025,Had the LOVe burger with baked fries and honestly its the best value meal around here for the quality you get
06/12/2025,"Lunch meeting here, Meatball box was full of flavour, 5 stars from me"
06/12/2025,"stopped by on my way to the station and grabbed a chicken wrap. quick service, tasty food, what more do you want really"
06/12/2025,Grabbed food on my break - fries were soggy unfortunately - Expected better tbh
07/12/2025,not gonna lie I was skeptical about 'healthy fast food' but Leon actually slaps. Had the LOVe burger and it was genuinely delicious. converted.
07/12/2025,Needed something quick - portion was smaller than expected - Might come back
07/12/2025,Office ordered from here - Sweet potato fries were banging - 3/5. ideal comfort food for winter honestly
07/12/2025,honestly a 3.5 out of 5 from me. food is tasty but the value for money just isnt quite there
07/12/2025,Finally gave Leon a try - Meatball box was full of flavour - Service was spot on - Deffo coming again
08/12/2025,3 stars. It's fine. Not life changing but not bad either. I go when I want something quick and vaguely healthy
08/12/2025,"stopped by on my way to the station and grabbed a chicken wrap. quick service, tasty food, what more do you want really"
08/12/2025,Had the seasonal salad and it was ok. A bit overdressed for my taste. The chicken was good but the leaves were sad looking
08/12/2025,Used to love Leon but the quality has gone right downhill. Everything tastes like its been sitting there for ages
08/12/2025,Came for breakfast actually! Seasonal soup was lovely and warming! The team here are always friendly! 3/5 👍
09/12/2025,food was good but they got my order wrong. I asked for no onions and there were onions everywhere. Staff apologised though
09/12/2025,"Had the Brazilian chicken bowl and it was heavenly. The rice was fluffy, chicken was perfectly seasoned. Chef's kiss"
09/12/2025,"Came for breakfast actually, Meatball box was full of flavour, Proper pleased with that"
09/12/2025,Third time this month I think. The chicken wrap was really tasty. Top stuff
